id,type,text,choiceA,choiceB,choiceC,choiceD,correctChoiceIndex,correctAnswerText,
q_45,MULTIPLE_CHOICE,"""Con người tân tiến mong nghe những ____ hơn là những thầy dạy, và nếu họ có lắng nghe các thầy dạy là bởi vì các vị thầy này là những _____"". Điền từ còn thiếu",Người rao giảng/ chứng nhân,Chứng nhân/ chứng nhân,Chứng nhân/thừa tác viên,Người rao giảng/ thừa tác viên,B,"Giải thích: “Như Chúng Tôi gần đây đã nói với một nhóm giáo dân: ""Con người tân tiến mong nghe những chứng nhân hơn là những thầy dạy, và nếu họ có lắng nghe các thầy dạy là bởi vì các vị thầy này là những chứng nhân""” (41)",
rw_46,REAL_WORLD_CHALLENGE,"Thử thách: Tam sao thất bản
Một bạn đại diện lên nhận gợi ý của Ban tổ chức, sau đó diễn tả sao cho những người ở đội mình hiểu được mà không dùng lời nói, mỗi lượt chơi có 3 gợi ý, trả lời đúng 2/3  gợi ý thì được tính là vượt qua thử thách.",,,,,,,
q_47,MULTIPLE_CHOICE,Việc ban phát các bí tích có thể mất đi hiệu năng rất nhiều nếu thiếu sự trợ giúp của yếu tố nào sau đây?,Việc làm chứng bằng đời sống,Việc giảng dạy giáo lí,Việc trò chuyện thân mật,Việc khăng khít trong lòng,B,"Trích: “Thật thế, trong việc ban phát các bí tích, nếu không được trợ giúp vững chắc của việc dạy giáo lý, có thể chấm dứt bằng việc làm các bí tích mất đi hiệu năng rất nhiều. “(47)",
q_48,ESSAY,"Trong việc mục vụ, nhân đức đối thần nào nhắc nhở cho tất cả những ai được Chúa đặt lãnh đạo cộng đồng giáo hội thái độ xứng hợp cần phải có đối với “lòng đạo đức bình dân”?",,,,,,"Đức ái
Giải thích: Ðức bác ái trong việc mục vụ phải nhắc nhở cho tất cả những ai, được Chúa đặt lãnh đạo cộng đồng giáo hội, thái độ xứng hợp cần phải có đối với thực tại này, một thực tại rất phong phú lại rất dễ bị tổn thương.",
